{"license":"CC BY-ND 4.0","file_hash":null,"name":"Orchid","version":"0.0.3","description":"Orchid is a solution designed for use in the Dynamo environment. The solution is designed to support practical, technical, geometrical, logical, and mathematical issues. The solution contains functions to solve data handling in Revit projects, Revit families, and materials in Revit. Besides this, also functions to solve common data handling like geometry, printing, exporting, and system actions. Orchid is among the largest and most coherent solutions besides what Autodesk releases for Dynamo.\n\nHowever, the Orchid solution MUST be downloaded from Github to get the complete solution. This 'package' is only a placeholder in the Dynamo 'Package Manager'. Please visit the repository at https://github.com/erfajo/OrchidForDynamo\n\n---\nORCHID MUST BE DOWNLOADED FROM GITHUB","group":"Orchid","keywords":["practical","technical","geometrical","logic","mathematical","system","element","project","family","material"],"dependencies":[],"contents":"","engine_version":"2.3.0.8352","engine":"dynamo","engine_metadata":"","site_url":"https://github.com/erfajo/OrchidForDynamo","repository_url":"https://github.com/erfajo/OrchidForDynamo","contains_binaries":true,"node_libraries":["Orchid, Version=0.0.2.0, Culture=neutral, PublicKeyToken=null","Orchid, Version=0.0.2.0, Culture=neutral, PublicKeyToken=null"]}